<?xml version="1.0" encoding="UTF-8"?>
<!DOCTYPE COMPONENT SYSTEM "component.dtd">
<!-- The COMPONENT xml files are used by various tools to generate CMP entity beans
    and some related configuration files.

    Generated by JetTools, do not edit this file directly.
    
    projetName : name of the project these descriptors are part of
    name : name of the component, not used for the moment -->
<COMPONENT projetName="SharePlot" name="ShareQuantity">
    
    <!-- BEANDEF : define the EJB specific information
        name : Name of the EJB
        persistence-type : Type of the EJB persistence mechanism, this may be Container, Bean
        ejbtype : Type of the EJB, this may be entity or session
        package : java package the EJB classes are to be created in
        ejbclass : name of the bean implementation class
        primkeyclass : name of the class to use as the PK object, in the case of an autoincremented key this must be java.lang.Object
        remote : name of the remote interface
        home : name of the home interface
    -->
    <BEANDEF name="ShareQuantity" 
        persistence-type="Container" 
        ejbtype="entity" 
        package="jet.shareplot.persistence.ejb.sharequantity" 
        ejbclass="ShareQuantityBean" 
        primkeyclass="java.lang.Object"
        remote="ShareQuantityRemote" 
        home="ShareQuantityHome"/>
    
    <!-- TABLE : describes the table this bean corresponds to
        name : name of the table in the database -->
    <TABLE name="ShareQuantity" localname="ShareQuantity">
        
        <!-- COLUMN : Describes a column in the table
            paramName : name to use for this column in the java classes 
            type : java type to use
            name : name of the column in the table
            dbtype : SQL type in the DB
            length : length in DB 
            noOfDecimal : number of decimal points (if appropriate)
            nullable : "true" if the column accepts null values
            autoIncrement : "true" if the column is flagged as auto-increment in the DB
            -->
        <COLUMN paramName="idShareQuantity" type="Long" name="idShareQuantity" localname="idShareQuantity" dbtype="INTEGER" length="10" noOfDecimal="0" nullable="false" autoIncrement="true" />
        <COLUMN paramName="idShare" type="Long" name="idShare" localname="idShare" dbtype="INTEGER" length="10" noOfDecimal="0" nullable="false" autoIncrement="false" />
        <COLUMN paramName="valueDate" type="java.util.Date" name="valueDate" localname="valueDate" dbtype="DATE" length="10" noOfDecimal="0" nullable="false" autoIncrement="false" />
        <COLUMN paramName="description" type="String" name="description" localname="description" dbtype="VARCHAR" length="1000" noOfDecimal="0" nullable="true" autoIncrement="false" />
        <COLUMN paramName="changeType" type="String" name="changeType" localname="changeType" dbtype="CHAR" length="1" noOfDecimal="0" nullable="false" autoIncrement="false" />
        <COLUMN paramName="changeValue" type="java.math.BigDecimal" name="changeValue" localname="changeValue" dbtype="DECIMAL" length="12" noOfDecimal="2" nullable="false" autoIncrement="false" />
        <COLUMN paramName="changeFee" type="java.math.BigDecimal" name="changeFee" localname="changeFee" dbtype="DECIMAL" length="12" noOfDecimal="2" nullable="false" autoIncrement="false" />
        <COLUMN paramName="changeQuantity" type="java.math.BigDecimal" name="changeQuantity" localname="changeQuantity" dbtype="DECIMAL" length="12" noOfDecimal="2" nullable="false" autoIncrement="false" />
        
        <!-- PRIMARYKEY : identifies the columns to use as primary key -->
        <PRIMARYKEY>
            <!-- KEYITEM : item of the PK
                component : name of the corresponding column
                type : java type to use
                paramName : name to use in the java classes -->
            <KEYITEM component="idShareQuantity" type="Long" paramName="idShareQuantity"/>
        </PRIMARYKEY>
        
        <!-- FOREIGNKEY : identifies the columns to use as foreign key -->
        <FOREIGNKEY name="fk_ShareQuantity_Share" foreigntable="Share" foreigntablelocalname="Share" >
            <FKITEM column="idShare" foreigncolumn="idShare" foreigncolumnlocalname="idShare" />
        </FOREIGNKEY>
        
    </TABLE>

    <!-- FINDER : This will define the list of finders that are to be generated
        default : not used
        name : name of the finder that is to be generated
     -->
        <!-- INPUT : defines an argument for the finder
            type : java type
            name : name to give the argument in the java classes -->
        <!-- FINDERBODY : 
            buffersize : not used
            sql_string : sql query string, this should always start with "where" 
            type : only "sql" is supported at the moment-->
    
    <!-- Define the transaction level for various methods -->
    <TRANSACTION type="Required">
        <METHOD name="remove"/>
    </TRANSACTION>
    <TRANSACTION type="Required">
        <METHOD name="create"/>
    </TRANSACTION>
    <TRANSACTION type="Required">
        <METHOD name="update"/>
    </TRANSACTION>
</COMPONENT>
